{
  "name": "bounded-write",
  "mode": "bounded-write",
  "tools": {
    "bash": "deny",
    "edit": "allow",
    "write": "allow",
    "task": "deny",
    "skill": "deny",
    "webfetch": "deny",
    "websearch": "deny",
    "todowrite": "deny"
  },
  "integrity": {
    "tree_must_be_identical": false,
    "git_identity_must_be_identical": true,
    "allow_worktree_edits": true
  },
  "notes": "Edits inside the leased worktree are expected. Git identity, remotes, worktree list, and local config must not change. Agent bash stays denied. Wrapper may run structured {verb,args} via ai-cmd. Not an OS write boundary."
}
